ID,Address,Price €,Rooms,Size m2,Floor,Lift,Links,Date_Scraped,Price_m2,Type,Neighborhood,City
101521020,"Piso en paseo de Torras i Bages, Sant Andreu, Barcelona",259000,4,76,Planta 2 exterior,Con ascensor,https://www.idealista.com/inmueble/101521020/,2023-06-12 17:35:40.902399,3407.89,Piso,Sant Andreu,Barcelona
101535348,"Piso en calle de Sant Antoni Maria Claret, Navas, Barcelona",280000,3,82,Planta 1 exterior,Con ascensor,https://www.idealista.com/inmueble/101535348/,2023-06-12 17:35:40.902399,3414.63,Piso,Navas,Barcelona
101428389,"Piso en avenida Meridiana, Sant Andreu, Barcelona",298000,4,114,Planta 5 exterior,Con ascensor,https://www.idealista.com/inmueble/101428389/,2023-06-12 17:35:40.902399,2614.04,Piso,Sant Andreu,Barcelona
98588176,"Ático en Tossal, La Trinitat Vella, Barcelona",315000,3,103,Planta 3 exterior,Con ascensor,https://www.idealista.com/inmueble/98588176/,2023-06-12 17:35:40.902399,3058.25,Ático,La Trinitat Vella,Barcelona
99982692,"Piso en calle de l'Almirall Pròixida, Sant Andreu, Barcelona",195000,3,70,Planta 1 exterior,Con ascensor,https://www.idealista.com/inmueble/99982692/,2023-06-12 17:35:40.902399,2785.71,Piso,Sant Andreu,Barcelona
101615105,"Piso en calle de Ramon Albó, El Congrés i els Indians, Barcelona",300000,3,90,Planta 4,Con ascensor,https://www.idealista.com/inmueble/101615105/,2023-06-12 17:35:40.902399,3333.33,Piso,El Congrés i els Indians,Barcelona
101203688,"Piso en calle de Biscaia, Navas, Barcelona",229000,3,60,Planta 3 exterior,Con ascensor,https://www.idealista.com/inmueble/101203688/,2023-06-12 17:35:40.902399,3816.67,Piso,Navas,Barcelona
101470030,"Piso en La Trinitat Vella, Barcelona",329900,3,117,Planta 3 exterior,Con ascensor,https://www.idealista.com/inmueble/101470030/,2023-06-12 17:35:40.902399,2819.66,Piso,La Trinitat Vella,Barcelona
101163370,"Piso en calle de Ramon Albó, El Congrés i els Indians, Barcelona",300000,3,90,Planta 4,Con ascensor,https://www.idealista.com/inmueble/101163370/,2023-06-12 17:35:40.902399,3333.33,Piso,El Congrés i els Indians,Barcelona
101528403,"Piso en calle de Joan Comorera, Sant Andreu, Barcelona",349990,2,93,Bajo exterior,Con ascensor,https://www.idealista.com/inmueble/101528403/,2023-06-12 17:35:40.902399,3763.33,Piso,Sant Andreu,Barcelona
101605645,"Piso en calle del Pare Pérez del Pulgar, La Trinitat Vella, Barcelona",100000,3,60,Planta 3 exterior,Sin ascensor,https://www.idealista.com/inmueble/101605645/,2023-06-12 17:35:40.902399,1666.67,Piso,La Trinitat Vella,Barcelona
100137249,"Piso en calle de Cienfuegos, La Sagrera, Barcelona",169000,2,55,Bajo exterior,Con ascensor,https://www.idealista.com/inmueble/100137249/,2023-06-12 17:35:40.902399,3072.73,Piso,La Sagrera,Barcelona
100277131,"Chalet pareado en calle de Peronella, Sant Andreu, Barcelona",437000,4,145,N/A,N/A,https://www.idealista.com/inmueble/100277131/,2023-06-12 17:35:40.902399,3013.79,Chalet pareado,Sant Andreu,Barcelona
101485618,"Piso en calle de Can Ros, El Congrés i els Indians, Barcelona",248000,3,75,Planta 2 exterior,Con ascensor,https://www.idealista.com/inmueble/101485618/,2023-06-12 17:35:40.902399,3306.67,Piso,El Congrés i els Indians,Barcelona
101095805,"Ático en La Trinitat Vella, Barcelona",315000,3,103,Planta 3 exterior,Sin ascensor,https://www.idealista.com/inmueble/101095805/,2023-06-12 17:35:40.902399,3058.25,Ático,La Trinitat Vella,Barcelona
100145430,"Piso en La Trinitat Vella, Barcelona",139900,2,77,Planta 5 exterior,Sin ascensor,https://www.idealista.com/inmueble/100145430/,2023-06-12 17:35:40.902399,1816.88,Piso,La Trinitat Vella,Barcelona
101113458,"Casa o chalet independiente en El Congrés i els Indians, Barcelona",930000,4,476,N/A,N/A,https://www.idealista.com/inmueble/101113458/,2023-06-12 17:35:40.902399,1953.78,Casa o chalet independiente,El Congrés i els Indians,Barcelona
100771959,"Piso en La Sagrera, Barcelona",178000,2,59,Entreplanta exterior,Con ascensor,https://www.idealista.com/inmueble/100771959/,2023-06-12 17:35:40.902399,3016.95,Piso,La Sagrera,Barcelona
101017836,"Piso en calle de Garcilaso, 133, La Sagrera, Barcelona",515000,3,116,Planta 4 exterior,Con ascensor,https://www.idealista.com/inmueble/101017836/,2023-06-12 17:35:40.902399,4439.66,Piso,La Sagrera,Barcelona
97554832,"Piso en ronda del Guinardó, Navas, Barcelona",299000,3,97,Planta 7 exterior,Con ascensor,https://www.idealista.com/inmueble/97554832/,2023-06-12 17:35:40.902399,3082.47,Piso,Navas,Barcelona
99426101,"Casa o chalet independiente en calle de Servet, Sant Andreu, Barcelona",630000,4,177,N/A,N/A,https://www.idealista.com/inmueble/99426101/,2023-06-12 17:35:40.902399,3559.32,Casa o chalet independiente,Sant Andreu,Barcelona
100332826,"Piso en calle d'Olesa, La Sagrera, Barcelona",172000,3,57,Planta 6 exterior,Con ascensor,https://www.idealista.com/inmueble/100332826/,2023-06-12 17:35:40.902399,3017.54,Piso,La Sagrera,Barcelona
101354832,"Piso en calle Gran de Sant Andreu, 360, Sant Andreu, Barcelona",329000,2,69,Planta 5 exterior,Con ascensor,https://www.idealista.com/inmueble/101354832/,2023-06-12 17:35:40.902399,4768.12,Piso,Sant Andreu,Barcelona
100478209,"Piso en calle de Sant Antoni Maria Claret, Navas, Barcelona",269000,3,73,Planta 1,Con ascensor,https://www.idealista.com/inmueble/100478209/,2023-06-12 17:35:40.902399,3684.93,Piso,Navas,Barcelona
98513940,"Piso en El Bon Pastor, Barcelona",250000,1,53,,Sin ascensor,https://www.idealista.com/inmueble/98513940/,2023-06-12 17:35:40.902399,4716.98,Piso,El Bon Pastor,Barcelona
101277853,"Piso en La Sagrera, Barcelona",189000,2,57,Planta 4 exterior,Con ascensor,https://www.idealista.com/inmueble/101277853/,2023-06-12 17:35:40.902399,3315.79,Piso,La Sagrera,Barcelona
100986110,"Dúplex en La Trinitat Vella, Barcelona",139000,2,48,Bajo exterior,Con ascensor,https://www.idealista.com/inmueble/100986110/,2023-06-12 17:35:40.902399,2895.83,Dúplex,La Trinitat Vella,Barcelona
100295719,"Piso en calle de Concepción Arenal, El Congrés i els Indians, Barcelona",149700,2,56,Bajo interior,Con ascensor,https://www.idealista.com/inmueble/100295719/,2023-06-12 17:35:40.902399,2673.21,Piso,El Congrés i els Indians,Barcelona
99567092,"Ático en Sant Andreu, Barcelona",458000,2,112,Planta 6 exterior,Con ascensor,https://www.idealista.com/inmueble/99567092/,2023-06-12 17:35:40.902399,4089.29,Ático,Sant Andreu,Barcelona
101165718,"Ático en Sant Andreu, Barcelona",279801,3,59,Planta 5 exterior,Con ascensor,https://www.idealista.com/inmueble/101165718/,2023-06-12 17:35:40.902399,4742.39,Ático,Sant Andreu,Barcelona
