ID,Address,Price_€,Rooms,Bathrooms,Size_m2,Price_m2,Property_type,Seller_type,City,Neightbourhood,Links,Description,Date_Scraped
id4737003817660,Piso  Calvet. Piso con terraza en venta en zona turó park,1750000,5,4,292,5993,FLAT,SECOND_HAND,Barcelona,Sant Gervasi,https://www.habitaclia.com/comprar-piso-con_terraza_en_venta_en_zona_turo_park_sant_gervasi_galvany-barcelona-i4737003817660.htm?pag=36&hab=1&ban=1&f=&geo=p&from=list&lo=55,"En la demandada zona de Turó Park, a escasos 100 metros del parque y del mercado Galvany, se encuentra esta fantástica v...",2023-06-18
id684004350709,Ático  Malgrat. Ático en venta,230000,3,1,65,3538,PENTHOUSE,SECOND_HAND,Barcelona,Porta,https://www.habitaclia.com/comprar-atico-en_venta_porta-barcelona-i684004350709.htm?pag=36&hab=1&ban=1&f=&geo=p&from=list&lo=55,"¡Descubre este luminoso ático en uno de los mejores barrios de la ciudad! Con 65?m² construidos, este espacioso apartame...",2023-06-18
id2994003327622,"Piso  Poblenou. Piso con 3 habitaciones con ascensor, calefacción y aire acondic",350000,3,1,82,4268,FLAT,SECOND_HAND,Barcelona,Poblenou,https://www.habitaclia.com/comprar-piso-con_3_habitaciones_con_ascensor_calefaccion_y_aire_acondic_poblenou-barcelona-i2994003327622.htm?pag=37&hab=1&ban=1&f=&geo=p&from=list&lo=55,"PRODUCTO EXCLUSIVO DE APIALIA  Vivienda a reformar a medida,  ideal familias.En Rambla POblenou, con Orientación Sur....",2023-06-18
id32937000000244,Piso  Via favència. Piso exterior con vistas despejadas y ascensor,215000,3,1,82,2622,FLAT,SECOND_HAND,Barcelona,Canyelles,https://www.habitaclia.com/comprar-piso-exterior_con_vistas_despejadas_y_ascensor_canyelles-barcelona-i32937000000244.htm?pag=37&hab=1&ban=1&f=&geo=p&from=list&lo=55,Si real estate le presenta esta vivienda en exclusiva en finca atractiva con ITE actualizada y ascensor: Piso exterior...,2023-06-18
id21572004122259,Piso  en  Balmes 433. Espectacular piso en venta de 81m² con piscina comunitaria y sol,740000,3,2,81,9136,FLAT,SECOND_HAND,Barcelona,Sant Gervasi,https://www.habitaclia.com/comprar-piso-espectacular_en_venta_de_81m2_con_piscina_comunitaria_y_sol_balmes_433_sant_gervasi_bonanova-barcelona-i21572004122259.htm?pag=37&hab=1&ban=1&f=&geo=p&from=list&lo=55,Obra finalizada.  Espectacular piso en venta de 81m² en Sant Gervasi-La Bonanova. La vivienda forma parte de la promoci...,2023-06-18
id28371003773812,"Piso  Balmes. Piso en venta en barcelona, con 145 m2, 4 habitaciones y 2 baños",675000,4,2,145,4655,FLAT,SECOND_HAND,Barcelona,Sant Gervasi,https://www.habitaclia.com/comprar-piso-en_venta_en_con_145_m2_4_habitaciones_y_2_banos_sant_gervasi_bonanova-barcelona-i28371003773812.htm?pag=37&hab=1&ban=1&f=&geo=p&from=list&lo=55,"Colibree les presenta emblemático piso en calle Balmes, junto a la estación del puxet. Se ofrece esta especial vivienda...",2023-06-18
id4737003815420,Piso  Carrer de la legalitat. Piso con balcón-terraza en venta en gràcia nova,382500,3,1,70,5464,FLAT,SECOND_HAND,Barcelona,El Camp d´en Grassot i Gràcia Nova,https://www.habitaclia.com/comprar-piso-con_balcon_terraza_en_venta_en_gracia_nova_el_camp_d_en_grassot_i_gracia_nova-barcelona-i4737003815420.htm?pag=37&hab=1&ban=1&f=&geo=p&from=list&lo=55,"Con una ubicación inmejorable, en la demandada zona de Gràcia-Nova, rodeado de todos los servicios y comercios de la zon...",2023-06-18
id4737003817106,Piso  Carrer de l'abat samsó. Ático – tríplex en venta en el centro de sarrià,850000,3,3,114,7456,FLAT,SECOND_HAND,Barcelona,Sarrià,https://www.habitaclia.com/comprar-piso-atico_triplex_en_venta_en_el_centro_de_sarria_sarria-barcelona-i4737003817106.htm?pag=37&hab=1&ban=1&f=&geo=p&from=list&lo=55,Espectacular piso de tres plantas en pleno centro de Sarrià.  Consta de 140 metros cuadrados construidos más una terra...,2023-06-18
id4737003813725,Piso  Carrer de campoamor. Casa catalogada en venta en horta,1850000,17,8,667,2774,FLAT,SECOND_HAND,Barcelona,Horta,https://www.habitaclia.com/comprar-piso-casa_catalogada_en_venta_en_horta_horta-barcelona-i4737003813725.htm?pag=37&hab=1&ban=1&f=&geo=p&from=list&lo=55,CASA CATALOGADA ORIGINARIA DEL 1864 EN HORTA.  Preciosa casa catalogada en la mejor calle de Horta con vistas inmejora...,2023-06-18
id38573000000353,Piso  Carrer d'andrea dòria. Piso junto a la playa de la barceloneta,185000,2,1,45,4111,FLAT,SECOND_HAND,Barcelona,Barceloneta,https://www.habitaclia.com/comprar-piso-junto_a_la_playa_de_la_barceloneta_barceloneta-barcelona-i38573000000353.htm?pag=37&hab=1&ban=1&f=&geo=p&from=list&lo=55,"Vivienda situada a 4 minutos de la Playa de la Barceloneta, en una de las zonas con más encanto de Barcelona y a la vez...",2023-06-18
id4737003817413,Casa  Passatge de serrahima. Casa con jardin y terraza en venta en poble sec,850000,4,2,139,6115,HOUSE,SECOND_HAND,Barcelona,El Poble Sec,https://www.habitaclia.com/comprar-casa-con_jardin_y_terraza_en_venta_en_poble_sec_el_poble_sec_parc_de_montjuic-barcelona-i4737003817413.htm?pag=37&hab=1&ban=1&f=&geo=p&from=list&lo=55,En el tranquilo y silencioso barrio de Montjuïc está el Passatge Serrahíma donde nos encontramos esta espectacular casa...,2023-06-18
id4737003816096,"Piso  Carrer de sant pere més alt. Piso en venta con terraza en sant pere, santa caterina i la ribe",695000,4,1,179,3883,FLAT,SECOND_HAND,Barcelona,St. Pere,https://www.habitaclia.com/comprar-piso-en_venta_con_terraza_en_sant_pere_santa_caterina_i_la_ribe_st_pere_sta_caterina_el_born-barcelona-i4737003816096.htm?pag=37&hab=1&ban=1&f=&geo=p&from=list&lo=55,En una ubicación privilegiada del Borne encontramos esta preciosa vivienda a reformar con inmejorables vistas al Palau d...,2023-06-18
id1521004413093,Piso  Carrer de valència. Precioso piso esquinero con balcón en pleno eixample barcelonés,469000,5,2,110,4264,FLAT,SECOND_HAND,Barcelona,L´Antiga Esquerra de l´Eixample,https://www.habitaclia.com/comprar-piso-precioso_esquinero_con_balcon_en_pleno_eixample_barcelones_l_antiga_esquerra_de_l_eixample-barcelona-i1521004413093.htm?pag=37&hab=1&ban=1&f=&geo=p&from=list&lo=55,"En una de las mejores zonas de Barcelona, encontramos este espacioso piso de 110m2 construidos con una cómoda distribuci...",2023-06-18
id4737003817463,Piso  Av. diagonal. Piso en venta en avenida diagonal,1050000,5,4,208,5048,FLAT,SECOND_HAND,Barcelona,Sant Gervasi,https://www.habitaclia.com/comprar-piso-en_venta_en_avenida_diagonal_sant_gervasi_galvany-barcelona-i4737003817463.htm?pag=37&hab=1&ban=1&f=&geo=p&from=list&lo=55,"Magnífico piso con mucha luz, situado en la Avenida Diagonal en una finca Regia del 1940.  Actualmente la propiedad se...",2023-06-18
id5396004301288,Planta baja  Carrer d'artà. Planta baja totalmente exterior en calle peatonal,235000,3,1,83,2831,GROUND_FLOOR,SECOND_HAND,Barcelona,Porta,https://www.habitaclia.com/comprar-planta_baja-totalmente_exterior_en_calle_peatonal_porta-barcelona-i5396004301288.htm?pag=37&hab=1&ban=1&f=&geo=p&from=list&lo=55,"Immotècnics Boutique Real Estate os presenta esta exclusiva vivienda ubicada en una calle totalmente peatonal, con acces...",2023-06-18
id4509004192414,"Piso  Rambla de catalunya. Piso en finca de 1900 situada en la cuarta planta, exterior a la",1390000,4,2,192,7240,FLAT,SECOND_HAND,Barcelona,Dreta de l´Eixample,https://www.habitaclia.com/comprar-piso-en_finca_de_1900_situada_en_la_cuarta_planta_exterior_a_la_dreta_de_l_eixample-barcelona-i4509004192414.htm?pag=37&hab=1&ban=1&f=&geo=p&from=list&lo=55,"RAMBLA CATALUÑA / CONSEJO DE CIENTO  Junto al paseo de Gracia, encontramos vivienda exterior a calle y a patio de manza...",2023-06-18
id32937000000224,"Piso  Carrer del segre. Gran piso en zona inmejorable. amplio, exterior y soleado.",319900,4,2,100,3199,FLAT,SECOND_HAND,Barcelona,Sant Andreu de Palomar,https://www.habitaclia.com/comprar-piso-gran_en_zona_inmejorable_amplio_exterior_y_soleado_sant_andreu_de_palomar-barcelona-i32937000000224.htm?pag=37&hab=1&ban=1&f=&geo=p&from=list&lo=55,SI REAL ESTATE les presenta un gran piso en un excelente edificio totalmente renovado con ascensor.  El inmueble se com...,2023-06-18
id4840004296739,Ático  en  Dreta de l´Eixample,890000,2,2,90,9889,PENTHOUSE,SECOND_HAND,Barcelona,Dreta de l´Eixample,https://www.habitaclia.com/comprar-atico-dreta_de_l_eixample-barcelona-i4840004296739.htm?pag=38&hab=1&ban=1&f=&geo=p&from=list&lo=55,Magnífico ático con terraza reformado a estrenar en ubicación prime del Eixample.  Este sensacional ático reformado a...,2023-06-18
id13478004397249,Piso  Carrer de la jota. Piso con 3 habitaciones con ascensor y calefacción,239000,3,1,86,2779,FLAT,SECOND_HAND,Barcelona,Vilapicina,https://www.habitaclia.com/comprar-piso-con_3_habitaciones_con_ascensor_y_calefaccion_vilapicina_torre_llobeta-barcelona-i13478004397249.htm?pag=38&hab=1&ban=1&f=&geo=p&from=list&lo=55,"Ubicada en una de las calles mas residenciales de Virrei Amat, la vivienda se encuentra situada cerca de todo tipos de c...",2023-06-18
id4737003817519,Dúplex  en  Sarrià. Piso en venta en sarria,950000,4,2,162,5864,DUPLEX,SECOND_HAND,Barcelona,Sarrià,https://www.habitaclia.com/comprar-duplex-piso_en_venta_en_sarria_sarria-barcelona-i4737003817519.htm?pag=38&hab=1&ban=1&f=&geo=p&from=list&lo=55,Fantastica vivienda en Sarria. El piso es un duplex con acceso a rellano por las dos plantas. En la planta alta nos enco...,2023-06-18
id18274004416373,Piso  en  Calle valencia 495,384000,3,2,85,4518,FLAT,SECOND_HAND,Barcelona,Sagrada Família,https://www.habitaclia.com/comprar-piso-valencia_495_sagrada_familia-barcelona-i18274004416373.htm?pag=38&hab=1&ban=1&f=&geo=p&from=list&lo=55,"Compra tu nuevo hogar SIN INTERMEDIARIOS, directamente con el PROPIETARIO sin tener que pagar más del precio de venta....",2023-06-18
id19086004316049,Piso  en  Sant Gervasi - Galvany. Acogedora vivienda reformada en tercera altura en galvany,550000,3,1,66,8333,FLAT,SECOND_HAND,Barcelona,Sant Gervasi,https://www.habitaclia.com/comprar-piso-acogedora_vivienda_reformada_en_tercera_altura_en_galvany_sant_gervasi_galvany-barcelona-i19086004316049.htm?pag=38&hab=1&ban=1&f=&geo=p&from=list&lo=55,TØRIL MÖLLER presenta piso reformado en tercera altura Galvany en finca de 1979. Se trata de una pieza encantadora de pl...,2023-06-18
id18274004415900,Piso  en  Cl josep pla 42,369000,3,2,75,4920,FLAT,SECOND_HAND,Barcelona,Besòs,https://www.habitaclia.com/comprar-piso-cl_josep_pla_42_besos_maresme-barcelona-i18274004415900.htm?pag=38&hab=1&ban=1&f=&geo=p&from=list&lo=55,"Homy Capital tiene en su cartera activa este inmueble en Sant Martí, Barcelona.   El inmueble de 75 m², se encuentra en...",2023-06-18
id4737003815529,Piso  en  Vila de Gràcia. Vivienda de dos habitaciones y jardín en gràcia,475000,2,2,140,3393,FLAT,SECOND_HAND,Barcelona,Vila de Gràcia,https://www.habitaclia.com/comprar-piso-vivienda_de_dos_habitaciones_y_jardin_en_gracia_vila_de_gracia-barcelona-i4737003815529.htm?pag=38&hab=1&ban=1&f=&geo=p&from=list&lo=55,"En pleno corazón del barrio de Gracia, cerca de la plaza Joanic y del Paseo San Juan, encontramos esta preciosa vivienda...",2023-06-18
id3630004247920,Piso  en  Sant Martí de Provençals. Amplia y luminosa vivienda en sant martí!,320000,4,2,143,2238,FLAT,SECOND_HAND,Barcelona,Sant Martí de Provençals,https://www.habitaclia.com/comprar-piso-amplia_y_luminosa_vivienda_en_sant_marti_sant_marti_de_provencals-barcelona-i3630004247920.htm?pag=38&hab=1&ban=1&f=&geo=p&from=list&lo=55,"SE VENDE PISO EN FINCA OBRA VISTA Vivienda exterior muy luminosa para actualizar orientado a tres vientos; Mar, Gerona y...",2023-06-18
id9873002103076,Piso  en  Dreta de l´Eixample. Piso a estrenar con vistas panorámicas en plaza urquinaona,1100000,3,2,195,5641,FLAT,SECOND_HAND,Barcelona,Dreta de l´Eixample,https://www.habitaclia.com/comprar-piso-a_estrenar_con_vistas_panoramicas_en_plaza_urquinaona_dreta_de_l_eixample-barcelona-i9873002103076.htm?pag=38&hab=1&ban=1&f=&geo=p&from=list&lo=55,"Situado en el décimo piso del primer rascacielos construido en Barcelona, se encuentra este espacioso inmueble de aproxi...",2023-06-18
id19465004034091,Piso  en  El Poble Sec - Parc de Montjuïc. Piso amplio junto plaça españa,298000,4,2,80,3725,FLAT,SECOND_HAND,Barcelona,El Poble Sec,https://www.habitaclia.com/comprar-piso-amplio_junto_placa_espana_el_poble_sec_parc_de_montjuic-barcelona-i19465004034091.htm?pag=38&hab=1&ban=1&f=&geo=p&from=list&lo=55,Piso de 80 m2 ubicado en una de las zonas más emblemáticas de Barcelona. Tiene un amplio salón-comedor con salida a terr...,2023-06-18
id4737003816594,Ático  en  Vila de Gràcia. Ático con dos terrazas en venta en vila de gràcia,750000,3,2,123,6098,PENTHOUSE,SECOND_HAND,Barcelona,Vila de Gràcia,https://www.habitaclia.com/comprar-atico-con_dos_terrazas_en_venta_en_vila_de_gracia_vila_de_gracia-barcelona-i4737003816594.htm?pag=38&hab=1&ban=1&f=&geo=p&from=list&lo=55,"Situado en pleno corazón de la Vila de Gràcia, entre calles se mí peatonales, entre la plaza del Diamante y plaza de la...",2023-06-18
id9861003834637,Piso  en  Raval. Espectacular piso recién reformado.,390000,3,2,100,3900,FLAT,SECOND_HAND,Barcelona,Raval,https://www.habitaclia.com/comprar-piso-espectacular_recien_reformado_raval-barcelona-i9861003834637.htm?pag=38&hab=1&ban=1&f=&geo=p&from=list&lo=55,"Piso de 93 m2 con tres dormitorios (dos dobles y uno individual) y dos baños, totalmente reformado con gran gusto y una...",2023-06-18
id24359000008031,"Piso  en  Sagrada Família. Piso con 2 habitaciones con ascensor, calefacción y aire acondic",330000,2,1,59,5593,FLAT,SECOND_HAND,Barcelona,Sagrada Família,https://www.habitaclia.com/comprar-piso-con_2_habitaciones_con_ascensor_calefaccion_y_aire_acondic_sagrada_familia-barcelona-i24359000008031.htm?pag=38&hab=1&ban=1&f=&geo=p&from=list&lo=55,¡Vivienda única a estrenar!  Clikalia pone a la venta este inmueble exterior de 59 m2 en reforma. Se sitúa en la 2ª pl...,2023-06-18
id24359000008018,"Piso  en  Sant Gervasi - Galvany. Piso con 4 habitaciones con ascensor, calefacción y aire acondic",580000,4,2,106,5472,FLAT,SECOND_HAND,Barcelona,Sant Gervasi,https://www.habitaclia.com/comprar-piso-con_4_habitaciones_con_ascensor_calefaccion_y_aire_acondic_sant_gervasi_galvany-barcelona-i24359000008018.htm?pag=38&hab=1&ban=1&f=&geo=p&from=list&lo=55,¡Vivienda única a estrenar!  Clikalia pone a la venta este inmueble exterior de 106 m2 en reforma. Se sitúa en la 1ª p...,2023-06-18
id38529000000181,Chalet  en  Vallvidrera - Tibidabo - Les Planes. Finca modernista,3100000,10,8,648,4784,HOUSE,SECOND_HAND,Barcelona,Vallvidrera,https://www.habitaclia.com/comprar-chalet-finca_modernista_vallvidrera_tibidabo_les_planes-barcelona-i38529000000181.htm?pag=38&hab=1&ban=1&f=&geo=p&from=list&lo=55,"Finca modernista “Villa Tibidabo” de 648 m² de superficie construida registrada en una parcela de 1.317 m², diseñada por...",2023-06-18
id5612002808328,Piso  en  Dreta de l´Eixample. Piso con 4 habitaciones con ascensor y aire acondicionado,890000,4,1,178,5000,FLAT,SECOND_HAND,Barcelona,Dreta de l´Eixample,https://www.habitaclia.com/comprar-piso-con_4_habitaciones_con_ascensor_y_aire_acondicionado_dreta_de_l_eixample-barcelona-i5612002808328.htm?pag=39&hab=1&ban=1&f=&geo=p&from=list&lo=55,"Piso con terraza a reformar en Eixample Dreta, Barcelona Piso para reformar de 118m² construidos y con una terraza de 6...",2023-06-18
id9912004381670,Ático  en  Roquetes. Ático con 3 habitaciones con calefacción,189000,3,1,133,1421,PENTHOUSE,SECOND_HAND,Barcelona,Roquetes,https://www.habitaclia.com/comprar-atico-con_3_habitaciones_con_calefaccion_roquetes-barcelona-i9912004381670.htm?pag=39&hab=1&ban=1&f=&geo=p&from=list&lo=55,"ATICO en perfectas condiciones para entrar a vivir, TODO REFORMADO, con TERRAZA de 60m² y EXTERIOR, en una de las princi...",2023-06-18
id5329004354290,Piso  en  Sant Martí de Provençals. Atendemos directamente por whatsapp: +34 691.186.446 - thábata m,215000,3,1,64,3359,FLAT,SECOND_HAND,Barcelona,Sant Martí de Provençals,https://www.habitaclia.com/comprar-piso-atendemos_directamente_por_whatsapp_34_691186446_thabata_m_sant_marti_de_provencals-barcelona-i5329004354290.htm?pag=39&hab=1&ban=1&f=&geo=p&from=list&lo=55,"REFERENCIA: THAB-GUIP215  ATENDEMOS DIRECTAMENTE POR : Thábata Morales, Asesora Inmobiliaria...",2023-06-18
id5329004354149,Piso  en  Sant Martí de Provençals. Piso con 3 habitaciones con ascensor,215000,3,1,64,3359,FLAT,SECOND_HAND,Barcelona,Sant Martí de Provençals,https://www.habitaclia.com/comprar-piso-con_3_habitaciones_con_ascensor_sant_marti_de_provencals-barcelona-i5329004354149.htm?pag=39&hab=1&ban=1&f=&geo=p&from=list&lo=55,"REFERENCIA: MICA-VTA240  ATENDEMOS DIRECTAMENTE POR : MICAELA DELGADO, ASESORA INMOBILIARIA...",2023-06-18
id9861003834620,Piso  en  St. Pere - Sta. Caterina - El Born. Precioso piso en el corazón del born.,199000,1,1,50,3980,FLAT,SECOND_HAND,Barcelona,St. Pere,https://www.habitaclia.com/comprar-piso-precioso_en_el_corazon_del_born_st_pere_sta_caterina_el_born-barcelona-i9861003834620.htm?pag=39&hab=1&ban=1&f=&geo=p&from=list&lo=55,"Precioso piso en el corazón del Born, junto al paseo del Born.  Este piso en barrio del Born mide 50m2 construidos dis...",2023-06-18
id4017003409724,Piso  en  Sant Gervasi - Galvany. Espectacular piso en turó park,2550000,5,5,386,6606,FLAT,SECOND_HAND,Barcelona,Sant Gervasi,https://www.habitaclia.com/comprar-piso-espectacular_en_turo_park_sant_gervasi_galvany-barcelona-i4017003409724.htm?pag=39&hab=1&ban=1&f=&geo=p&from=list&lo=55,Gran propiedad en exclusiva en Turó Park.  Propiedad con un elegante y amplio recibidor que hace a la vez de distribui...,2023-06-18
id4017003409371,Ático  en  Dreta de l´Eixample. Fantástico ático en eixample con gran terraza,950000,2,2,110,8636,PENTHOUSE,SECOND_HAND,Barcelona,Dreta de l´Eixample,https://www.habitaclia.com/comprar-atico-fantastico_en_eixample_con_gran_terraza_dreta_de_l_eixample-barcelona-i4017003409371.htm?pag=39&hab=1&ban=1&f=&geo=p&from=list&lo=55,Ático super luminoso de 110m2 con gran terraza de 60m2 en Eixample Dreta con unas vistas maravillosas de la ciudad.  L...,2023-06-18
id3371004288590,"Piso  Avinguda de frederic rahola. Piso con ascensor, calefacción y aire acondicionado",354000,1,1,52,6808,FLAT,SECOND_HAND,Barcelona,La Font d´en Fargues,https://www.habitaclia.com/comprar-piso-con_ascensor_calefaccion_y_aire_acondicionado_la_font_d_en_fargues-barcelona-i3371004288590.htm?pag=39&hab=1&ban=1&f=&geo=p&from=list&lo=55,"Excepcional promoción de viviendas de obra nueva en el residencial barrio de Horta, en Barcelona. Se trata de una moder...",2023-06-18
id23591004308114,Piso  Calle cartagena. Piso con 2 habitaciones con ascensor y calefacción,240000,2,1,58,4138,FLAT,SECOND_HAND,Barcelona,Sagrada Família,https://www.habitaclia.com/comprar-piso-con_2_habitaciones_con_ascensor_y_calefaccion_sagrada_familia-barcelona-i23591004308114.htm?pag=39&hab=1&ban=1&f=&geo=p&from=list&lo=55,"La Casa Agency presenta fantástico piso en Calle Cartagena.   El piso consta de 58m2 distribuidos en: recibidor, cocin...",2023-06-18
id30106000000493,Apartamento  Amigo. Apartamento con calefacción y aire acondicionado,199000,1,1,45,4422,APARTMENT,SECOND_HAND,Barcelona,Sant Gervasi,https://www.habitaclia.com/comprar-apartamento-con_calefaccion_y_aire_acondicionado_sant_gervasi_galvany-barcelona-i30106000000493.htm?pag=39&hab=1&ban=1&f=&geo=p&from=list&lo=55,"Sarrià Properties "" Viviendas con Encanto""    ¡ NO COBRAMOS COMISIONES A NUESTROS CLIENTES COMPRADORES !    Se vende...",2023-06-18
id11220004332630,Piso  Cera. Piso en venta a reformar c/ cera,243700,4,2,101,2413,FLAT,SECOND_HAND,Barcelona,Raval,https://www.habitaclia.com/comprar-piso-en_venta_a_reformar_c_cera_raval-barcelona-i11220004332630.htm?pag=39&hab=1&ban=1&f=&geo=p&from=list&lo=55,"Piso interior en edificio sin ascensor distribuido en pasillo distribuidor, 4 habitaciones, 2 baños, cocina, patio y s...",2023-06-18
id38576000000328,Piso  en  La Font d´en Fargues. Zona la font d'en fargues,88000,1,1,22,4000,FLAT,SECOND_HAND,Barcelona,La Font d´en Fargues,https://www.habitaclia.com/comprar-piso-zona_la_font_d_en_fargues_la_font_d_en_fargues-barcelona-i38576000000328.htm?pag=39&hab=1&ban=1&f=&geo=p&from=list&lo=55,VISTAS PANORÁMICAS. PISO APARTAMENTO (CON CÉDULA DE HABITABILIDAD) en la calle Pedrell. La vivienda dispone de una habit...,2023-06-18
id14118004449882,"Piso  en  Carrer ferrocarrils catalans, 12. Obra nueva",320000,2,2,77,4156,FLAT,SECOND_HAND,Barcelona,La Marina del Port,https://www.habitaclia.com/comprar-piso-obra_nueva_calle_ferrocarrils_catalans_12_la_marina_del_port-barcelona-i14118004449882.htm?pag=39&hab=1&ban=1&f=&geo=p&from=list&lo=55,O7 es un exclusivo residencial de Kronos Homes que ofrece de 61 viviendas de 1 a 3 dormitorios ubicadas en un espectacul...,2023-06-18
id38576000000425,"Piso  en  La Teixonera. Apartamento junto vall de hebrón, alquilado alta rentabilidad, c",123000,1,1,50,2460,FLAT,SECOND_HAND,Barcelona,La Teixonera,https://www.habitaclia.com/comprar-piso-apartamento_junto_vall_de_hebron_alquilado_alta_rentabilidad_c_la_teixonera-barcelona-i38576000000425.htm?pag=39&hab=1&ban=1&f=&geo=p&from=list&lo=55,A CINCO MINUTOS DEL VALL DE HEBRÓN Y HOSPITAL SAN RAFAEL. Vivienda de una habitación suite con baño incluido dentro de l...,2023-06-18
id17891004042715,"Piso  Comtessa de sobradiel. Piso en venta a barcelona en el barrio del gótico, de 120m2, 3 h",450000,3,1,120,3750,FLAT,SECOND_HAND,Barcelona,Gòtic,https://www.habitaclia.com/comprar-piso-en_venta_a_en_el_barrio_del_gotico_de_120m2_3_h_gotic-barcelona-i17891004042715.htm?pag=39&hab=1&ban=1&f=&geo=p&from=list&lo=55,"Acogedor piso, alto y luminoso en una cuarta planta real de un edificio novecentista con ascensor, de una de las calles...",2023-06-18
id531205771226,"Piso  Valencia. Piso con 5 habitaciones con ascensor, parking, calefacción y air",695000,5,2,159,4371,FLAT,SECOND_HAND,Barcelona,L´Antiga Esquerra de l´Eixample,https://www.habitaclia.com/comprar-piso-con_5_habitaciones_con_ascensor_parking_calefaccion_y_air_l_antiga_esquerra_de_l_eixample-barcelona-i531205771226.htm?pag=40&hab=1&ban=1&f=&geo=p&from=list&lo=55,"La plaza de pk no estan incluidas en el precio. Piso ubicado en zona privilegiada del centro de la ciudad, en una finca...",2023-06-18
id9433003077826,Piso  Escoles pies. Piso en venta a reformar en tres torres.,550000,3,1,100,5500,FLAT,SECOND_HAND,Barcelona,Tres Torres,https://www.habitaclia.com/comprar-piso-en_venta_a_reformar_en_tres_torres_tres_torres-barcelona-i9433003077826.htm?pag=40&hab=1&ban=1&f=&geo=p&from=list&lo=55,La oportunidad de hacer realidad tus sueños y crear tu nuevo hogar a tu gusto no surge todos los días en Tres Torres. No...,2023-06-18
id19063000001424,Piso  Mar. Se vende este bonito y acogedor piso,189000,1,1,40,4725,FLAT,SECOND_HAND,Barcelona,Barceloneta,https://www.habitaclia.com/comprar-piso-se_vende_este_bonito_y_acogedor_barceloneta-barcelona-i19063000001424.htm?pag=40&hab=1&ban=1&f=&geo=p&from=list&lo=55,"Se vende este bonito y acogedor piso ubicado en el emblemático barrio de la Barceloneta, en la calle del Mar junto a Pla...",2023-06-18
id9433003077807,Piso  Tallers. Piso en venta a reformar en el casco antiguo de barcelona.,320000,2,1,85,3765,FLAT,SECOND_HAND,Barcelona,Raval,https://www.habitaclia.com/comprar-piso-en_venta_a_reformar_en_el_casco_antiguo_de_raval-barcelona-i9433003077807.htm?pag=40&hab=1&ban=1&f=&geo=p&from=list&lo=55,Piso en última planta a reformar en calle Tallers junto a plaza Universitat. La propiedad ofrece muchas posibilidades pa...,2023-06-18
id9354004270045,"Casa  Camí de lliçà. Casa con 6 habitaciones amueblada con parking, piscina, calefacc",3400000,6,6,850,4000,HOUSE,SECOND_HAND,Barcelona,Sarrià,https://www.habitaclia.com/comprar-casa-con_6_habitaciones_amueblada_con_parking_piscina_calefacc_sarria-barcelona-i9354004270045.htm?pag=40&hab=1&ban=1&f=&geo=p&from=list&lo=55,"Casa en venta en Can Caralleu, Barcelona.   Magnífica vivienda de diseño a 4 vientos.   Ubicada alta de sarria con v...",2023-06-18
id4737003817645,Dúplex  C/ de còrsega. Piso dúplex en venta con parking en sagrada familia,1090000,4,3,184,5924,DUPLEX,SECOND_HAND,Barcelona,Dreta de l´Eixample,https://www.habitaclia.com/comprar-duplex-piso_en_venta_con_parking_en_sagrada_familia_dreta_de_l_eixample-barcelona-i4737003817645.htm?pag=40&hab=1&ban=1&f=&geo=p&from=list&lo=55,"En una Calle muy tranquila tocando a Passeig de Sant Joan, rodeada de servicios y comercios y a 5 minutos del transporte...",2023-06-18
id4737003815700,Piso  Carrer del guadiana. Dúplex en venta con parking en sants,375000,3,2,142,2641,FLAT,SECOND_HAND,Barcelona,Sants,https://www.habitaclia.com/comprar-piso-duplex_en_venta_con_parking_en_sants_sants-barcelona-i4737003815700.htm?pag=40&hab=1&ban=1&f=&geo=p&from=list&lo=55,"En Sants, cerca de la plaza de Sants, en la calle Guadiana, encontramos este dúplex reformado, compuesto de 117m2 constr...",2023-06-18
id3900004300815,Loft  en  Putget - Farró. Loft en sarria sant gervasi junto al tenis barcino.,220000,1,1,90,2444,LOFT,SECOND_HAND,Barcelona,Putget,https://www.habitaclia.com/comprar-loft-en_sarria_sant_gervasi_junto_al_tenis_barcino_putget_farro-barcelona-i3900004300815.htm?pag=40&hab=1&ban=1&f=&geo=p&from=list&lo=55,"Superficie: 90 m² aprox. Distribución: Salón comedor, cocina abierta al salón comedor, 1 habitación, 1 baño. Observaci...",2023-06-18
id885003215409,Piso  en  El Poble Sec - Parc de Montjuïc. Gimbernat - mèxic,320000,3,1,73,4384,FLAT,SECOND_HAND,Barcelona,El Poble Sec,https://www.habitaclia.com/comprar-piso-gimbernat_mexic_el_poble_sec_parc_de_montjuic-barcelona-i885003215409.htm?pag=40&hab=1&ban=1&f=&geo=p&from=list&lo=55,GIMBERNAT - MÈXIC.- PISO EN VENTA EN EL BARRIO DE FONT DE LA GUATLLA. Vivienda de tres habitaciones (dos de ellas son do...,2023-06-18
