ID,Address,Price_€,Rooms,Bathrooms,Size_m2,Price_m2,Property_type,Seller_type,City,Neightbourhood,Links,Description,Date_Scraped
id23591004308071,"Ático  Carrer de pujades. Ático con 3 habitaciones con ascensor, calefacción y aire acondi",280000,3,1,76,3684,PENTHOUSE,SECOND_HAND,Barcelona,Besòs,https://www.habitaclia.com/comprar-atico-con_3_habitaciones_con_ascensor_calefaccion_y_aire_acondi_besos_maresme-barcelona-i23591004308071.htm?pag=14&hab=1&ban=1&f=&geo=p&from=list&lo=55,*****EXCELENTE PISO REFORMADO Y TOTALMENTE EXTERIOR*****  Hermoso inmueble totalmente reformado ubicado en la zona de...,2023-06-18
id11568004272503,Casa  Pons i gallarza. Casa tradicional del barrio de sant andreu,460000,5,2,183,2514,HOUSE,SECOND_HAND,Barcelona,Sant Andreu de Palomar,https://www.habitaclia.com/comprar-casa-tradicional_del_barrio_de_sant_andreu_sant_andreu_de_palomar-barcelona-i11568004272503.htm?pag=14&hab=1&ban=1&f=&geo=p&from=list&lo=55,"En una de las calles más tranquilas del barrio de Sant Andreu, peatonal y aderezada con naranjos, se ubica esta casa esq...",2023-06-18
id29735004324689,Piso  Carrer finlandia. Obra nueva,453000,2,2,82,5524,FLAT,SECOND_HAND,Barcelona,Sants,https://www.habitaclia.com/comprar-piso-obra_nueva_sants-barcelona-i29735004324689.htm?pag=14&hab=1&ban=1&f=&geo=p&from=list&lo=55,"Esta magnífica promoción de Obra Nueva de tipo boutique, se encuentra ubicada a dos pasos de la Plaza Sants, en un edifi...",2023-06-18
id10024004257066,Casa adosada  Coroleu. Casa en venda amb  jardí i terrat al centre de sant andreu,950000,6,3,209,4545,SINGLE_FAMILY_SEMI_DETACHED,SECOND_HAND,Barcelona,Sant Andreu de Palomar,https://www.habitaclia.com/comprar-casa_adosada-casa_en_venda_amb_jardi_i_terrat_al_centre_de_sant_andreu_sant_andreu_de_palomar-barcelona-i10024004257066.htm?pag=14&hab=1&ban=1&f=&geo=p&from=list&lo=55,"Casa única  al barri de Sant Andreu.  Situada en un dels millors carrers, al costat del carrer principal.  És una cas...",2023-06-18
id11568004272462,Piso  Sant crispi. Piso con solarium privado  en la teixonera - barcelona,275000,2,2,88,3125,FLAT,SECOND_HAND,Barcelona,La Teixonera,https://www.habitaclia.com/comprar-piso-con_solarium_privado_en_la_teixonera_la_teixonera-barcelona-i11568004272462.htm?pag=14&hab=1&ban=1&f=&geo=p&from=list&lo=55,"Se ofrece el piso de 88 m2 (62 m2 del apartamento +  26 m2 de solarium ) y con balcones de 1,44 m2 ,  en un barrio tranq...",2023-06-18
id10024004257076,Casa adosada  en  Sant Andreu de Palomar. Casa en venda al centre de sant andreu,560000,3,3,146,3836,SINGLE_FAMILY_SEMI_DETACHED,SECOND_HAND,Barcelona,Sant Andreu de Palomar,https://www.habitaclia.com/comprar-casa_adosada-casa_en_venda_al_centre_de_sant_andreu_sant_andreu_de_palomar-barcelona-i10024004257076.htm?pag=14&hab=1&ban=1&f=&geo=p&from=list&lo=55,"Casa impecable al centre de Sant Andreu, al costat de l'Ajuntament.  A prop del transport públic i de tots els serveis....",2023-06-18
id3901004273108,Piso  Plaça del doctor ignasi barraquer. Piso alto y familiar con bonito diseño para entrar a vivir.,625000,3,2,111,5631,FLAT,SECOND_HAND,Barcelona,Barri de les Corts,https://www.habitaclia.com/comprar-piso-alto_y_familiar_con_bonito_diseno_para_entrar_a_vivir_barri_de_les_corts-barcelona-i3901004273108.htm?pag=15&hab=1&ban=1&f=&geo=p&from=list&lo=55,Amplio y silencioso piso alto a poca distancia de la plaza Francesc Macia y la plaza de Ignasi Barraquer.  En la mejor...,2023-06-18
id37307004257087,Casa  en  Sarrià. Espectacular casa moderna con fantásticas vistas panorámicas de,7450000,7,4,1.600,4656,HOUSE,SECOND_HAND,Barcelona,Sarrià,https://www.habitaclia.com/comprar-casa-espectacular_moderna_con_fantasticas_vistas_panoramicas_de_sarria-barcelona-i37307004257087.htm?pag=15&hab=1&ban=1&f=&geo=p&from=list&lo=55,"Ubicada en la zona residencial de Can Caralleu, en el distrito de la zona alta de Barcelona, Sarrià  Tiene la siguient...",2023-06-18
id10024004257237,"Piso  en  Llenguadoc, 86. Pis en venda a barcelona, sant andreu, llenguadoc",430000,4,2,121,3554,FLAT,SECOND_HAND,Barcelona,Sant Andreu de Palomar,https://www.habitaclia.com/comprar-piso-pis_en_venda_a_sant_andreu_llenguadoc_llenguadoc_86_sant_andreu_de_palomar-barcelona-i10024004257237.htm?pag=15&hab=1&ban=1&f=&geo=p&from=list&lo=55,"Pis de 121m2 construïts, molt bona ubicació, al costat de la Rambla de Fabra i Puig , en un carrer de vianants.   Al...",2023-06-18
id39717000000113,Piso  en  Carrer de grífols. Piso con 2 habitaciones con ascensor y calefacción,200000,2,1,51,3922,FLAT,SECOND_HAND,Barcelona,Horta,https://www.habitaclia.com/comprar-piso-con_2_habitaciones_con_ascensor_y_calefaccion_calle_de_grifols_horta-barcelona-i39717000000113.htm?pag=15&hab=1&ban=1&f=&geo=p&from=list&lo=55,***CASAVO BARCELONA PRESENTA SIN COMISIONES PARA EL COMPRADOR***  PLANTA BAJA CON PATIO INTERIOR. 51 M2 construidos. 2...,2023-06-18
id885003214988,Piso  en  L´Antiga Esquerra de l´Eixample. València - aribau,595000,5,2,128,4648,FLAT,SECOND_HAND,Barcelona,L´Antiga Esquerra de l´Eixample,https://www.habitaclia.com/comprar-piso-valencia_aribau_l_antiga_esquerra_de_l_eixample-barcelona-i885003214988.htm?pag=15&hab=1&ban=1&f=&geo=p&from=list&lo=55,VALÈNCIA - ARIBAU Fantástico piso en el centro de l´ Eixample en la calle Valencia entre Aribau y Muntaner. Piso para de...,2023-06-18
id885003215832,Planta baja  en  Vilapicina - Torre Llobeta. Pº maragall - sabastida,320000,3,2,120,2667,GROUND_FLOOR,SECOND_HAND,Barcelona,Vilapicina,https://www.habitaclia.com/comprar-planta_baja-po_maragall_sabastida_vilapicina_torre_llobeta-barcelona-i885003215832.htm?pag=15&hab=1&ban=1&f=&geo=p&from=list&lo=55,"SABASTIDA - PASEO MARAGALL  piso a la venta en Barcelona, vivienda de 3 habitaciones, salón, tribuna, cocina office, 2 b...",2023-06-18
id4526003789339,Piso  en  Putget - Farró. Excelente piso con pàrking en calle balmes - putxet muy cerca me,799000,5,3,175,4566,FLAT,SECOND_HAND,Barcelona,Putget,https://www.habitaclia.com/comprar-piso-excelente_con_parking_en_calle_balmes_putxet_muy_cerca_me_putget_farro-barcelona-i4526003789339.htm?pag=15&hab=1&ban=1&f=&geo=p&from=list&lo=55,"EXCELENTE PISO CON PARKING EN CALLE BALMES - PUTXET, MUY CERCA DEL MERCADO DE SANT GERVASI   Le presentamos esta vivie...",2023-06-18
id39032000000645,Ático  Travessera de les corts. Ático con 4 habitaciones con ascensor,375000,4,1,85,4412,PENTHOUSE,SECOND_HAND,Barcelona,Sant Ramon,https://www.habitaclia.com/comprar-atico-con_4_habitaciones_con_ascensor_sant_ramon_maternitat-barcelona-i39032000000645.htm?pag=15&hab=1&ban=1&f=&geo=p&from=list&lo=55,"Excelente ático sito en Travessera de les Corts (junto metro Collblanc), a reformar.  Vivienda de 85 m2 construidos (7...",2023-06-18
id12826004094595,Piso  Fastenrath. Piso amueblado con parking y aire acondicionado,109000,1,1,35,3114,FLAT,SECOND_HAND,Barcelona,Carmel,https://www.habitaclia.com/comprar-piso-amueblado_con_parking_y_aire_acondicionado_carmel-barcelona-i12826004094595.htm?pag=15&hab=1&ban=1&f=&geo=p&from=list&lo=55,Apartamento de 35m2 en venta ubicado en el barrio del Carmel. Plaza de pasquín incluida.  Compuesto por un luminoso sa...,2023-06-18
id3901004273035,"Ático  Carrer de mandri. Ático con 4 habitaciones con ascensor, parking, calefacción y ai",1650000,4,4,252,6548,PENTHOUSE,SECOND_HAND,Barcelona,Sant Gervasi,https://www.habitaclia.com/comprar-atico-con_4_habitaciones_con_ascensor_parking_calefaccion_y_ai_sant_gervasi_bonanova-barcelona-i3901004273035.htm?pag=15&hab=1&ban=1&f=&geo=p&from=list&lo=55,ESPECTACULAR ÁTICO DÚPLEX ÚNICO EN LA ZONA.  REFORMA INTEGRAL CON MATERIALES DE MÁXIMA CALIDAD   La planta baja const...,2023-06-18
id21842000001024,"Piso  en  Pedralbes. Piso en venta en c. beltran i rozpide..., bcn-sarria -sant gerva",1525000,3,3,229,6659,FLAT,SECOND_HAND,Barcelona,Pedralbes,https://www.habitaclia.com/comprar-piso-en_venta_en_c_beltran_i_rozpide_bcn_sarria_sant_gerva_pedralbes-barcelona-i21842000001024.htm?pag=15&hab=1&ban=1&f=&geo=p&from=list&lo=55,"On Llar. Vivienda distribuida en 3 habitación/s, 3 baño/s, cocina y salón-comedor. Piscina.  Ubicado en la localidad d...",2023-06-18
id24368000000128,Piso  en  Putget - Farró. Piso en venta en finca regia en el putxet i el farró,925000,4,3,162,5710,FLAT,SECOND_HAND,Barcelona,Putget,https://www.habitaclia.com/comprar-piso-en_venta_en_finca_regia_en_el_putxet_i_el_farro_putget_farro-barcelona-i24368000000128.htm?pag=15&hab=1&ban=1&f=&geo=p&from=list&lo=55,"Magnífico piso situado cerca de Lesseps, en una finca regia, y en muy buen estado.     Nos encontramos con una propied...",2023-06-18
id13370000000127,"Piso  en  Prosperitat. 3 habitaciones (2 dobles), con patio amplio.",209900,3,1,129,1627,FLAT,SECOND_HAND,Barcelona,Prosperitat,https://www.habitaclia.com/comprar-piso-3_habitaciones_2_dobles_con_patio_amplio_prosperitat-barcelona-i13370000000127.htm?pag=15&hab=1&ban=1&f=&geo=p&from=list&lo=55,"3 habitaciones (2 Dobles), Con Patio amplio.  •	Habitación Matrimonio. •	Habitación Doble. •	Habitación Individual....",2023-06-18
id5612004474168,"Piso  en  Passeig gracia, 30. Obra nueva",1105000,2,2,70,15786,FLAT,SECOND_HAND,Barcelona,Dreta de l´Eixample,https://www.habitaclia.com/comprar-piso-obra_nueva_paseo_gracia_30_dreta_de_l_eixample-barcelona-i5612004474168.htm?pag=15&hab=1&ban=1&f=&geo=p&from=list&lo=55,"Piso con Piscina a estrenar en Paseo de Gracia, Barcelona Exclusiva vivienda de 68m2 construidos distribuidos en amplio...",2023-06-18
id3780004318227,"Piso  en  Carrer navas de tolosa, 310. Obra nueva",550000,3,2,99,5556,FLAT,SECOND_HAND,Barcelona,Navas,https://www.habitaclia.com/comprar-piso-obra_nueva_calle_navas_de_tolosa_310_navas-barcelona-i3780004318227.htm?pag=15&hab=1&ban=1&f=&geo=p&from=list&lo=55,"Edificio de obra nueva de planta baja y cinco alturas; compuesto por 15 unidades residenciales. Diversas viviendas, de u...",2023-06-18
id36271004439206,Piso  en  Dreta de l´Eixample. Obra nueva,1150000,2,1,92,12500,FLAT,SECOND_HAND,Barcelona,Dreta de l´Eixample,https://www.habitaclia.com/comprar-piso-obra_nueva_dreta_de_l_eixample-barcelona-i36271004439206.htm?pag=16&hab=1&ban=1&f=&geo=p&from=list&lo=55,"Nos complace presentar esta finca regia renovada con 17 apartamentos de diseño contemporáneo, ubicada en la icónica Ramb...",2023-06-18
id885003215229,Piso  en  Sarrià. Sarriá - plaza de sarriá,840000,5,3,125,6720,FLAT,SECOND_HAND,Barcelona,Sarrià,https://www.habitaclia.com/comprar-piso-sarria_plaza_de_sarria_sarria-barcelona-i885003215229.htm?pag=16&hab=1&ban=1&f=&geo=p&from=list&lo=55,MAYOR DE SARRIA - COLEGIO SAGRADO CORAZÓN en Living les presentamos esta propiedad en exclusiva. Situada en el corazón d...,2023-06-18
id19086004316061,"Piso  Aribau. Piso con 3 habitaciones con ascensor, parking, calefacción y air",671000,3,2,114,5886,FLAT,SECOND_HAND,Barcelona,Sant Gervasi,https://www.habitaclia.com/comprar-piso-con_3_habitaciones_con_ascensor_parking_calefaccion_y_air_sant_gervasi_galvany-barcelona-i19086004316061.htm?pag=16&hab=1&ban=1&f=&geo=p&from=list&lo=55,TØRIL MÖLLER presenta piso en segunda altura en finca de 1975 de 100m2 Ofrece salón comedor amplio y exterior con disfr...,2023-06-18
id39032000000661,Piso  Carrer de la riera blanca. Piso con 3 habitaciones con ascensor,199000,3,1,71,2803,FLAT,SECOND_HAND,Barcelona,Sants-Badal,https://www.habitaclia.com/comprar-piso-con_3_habitaciones_con_ascensor_sants_badal-barcelona-i39032000000661.htm?pag=16&hab=1&ban=1&f=&geo=p&from=list&lo=55,"Piso de 71 m2 en calle de la Riera Blanca, a actualizar. Dispone de salón, 3 habitaciones (1 doble y 2 individuales), c...",2023-06-18
id10804004400339,Piso  Carrer de lorda. Obra nueva - 4 habitaciones con terraza,475000,4,2,140,3393,FLAT,SECOND_HAND,Barcelona,La Teixonera,https://www.habitaclia.com/comprar-piso-obra_nueva_4_habitaciones_con_terraza_la_teixonera-barcelona-i10804004400339.htm?pag=16&hab=1&ban=1&f=&geo=p&from=list&lo=55,Estrena vivienda de OBRA NUEVA - Piso de 4 habitaciones con 25m de zona exterior a estrenar (ver vídeo)   Principales...,2023-06-18
id9354004269994,"Ático  Passeig de manuel girona. Ático con 4 habitaciones amueblado con ascensor, parking, calefa",1650000,4,3,140,11786,PENTHOUSE,SECOND_HAND,Barcelona,Sarrià,https://www.habitaclia.com/comprar-atico-con_4_habitaciones_amueblado_con_ascensor_parking_calefa_sarria-barcelona-i9354004269994.htm?pag=16&hab=1&ban=1&f=&geo=p&from=list&lo=55,"Ático en venta Sarrià, Barcelona. En finca del reconocido arquitecto Coderch, ático de unos 140m2 + otros 140m2 aproxima...",2023-06-18
id39032000000611,Dúplex  Carrer d'aragó. Dúplex con 4 habitaciones con ascensor y aire acondicionado,700000,4,2,116,6034,DUPLEX,SECOND_HAND,Barcelona,Dreta de l´Eixample,https://www.habitaclia.com/comprar-duplex-con_4_habitaciones_con_ascensor_y_aire_acondicionado_dreta_de_l_eixample-barcelona-i39032000000611.htm?pag=16&hab=1&ban=1&f=&geo=p&from=list&lo=55,"Excelente ático-dúplex en calle Aragó-Bruc de 116 m2 con gran terraza de 50 m2.  Dispone de salón-comedor, cocina inde...",2023-06-18
id9912004381831,Piso  en  Prosperitat,298000,4,1,105,2838,FLAT,SECOND_HAND,Barcelona,Prosperitat,https://www.habitaclia.com/comprar-piso-prosperitat-barcelona-i9912004381831.htm?pag=16&hab=1&ban=1&f=&geo=p&from=list&lo=55,"Exclusivo piso en la misma Vía Julia, casi todo exterior, con 4 dormitorios DOBLES bien amplios, en muy buena finca con...",2023-06-18
id3630004247960,Piso  en  Barceloneta. Precioso piso en calle joan de borbó,305000,3,1,60,5083,FLAT,SECOND_HAND,Barcelona,Barceloneta,https://www.habitaclia.com/comprar-piso-precioso_en_calle_joan_de_borbo_barceloneta-barcelona-i3630004247960.htm?pag=16&hab=1&ban=1&f=&geo=p&from=list&lo=55,Precioso piso en el popular barrio de La Barceloneta ¡A solo 3 minutos de la playa! Piso de 60 m² listo para entrar a vi...,2023-06-18
id13370000000131,"Piso  en  Trinitat Nova. Todo reformado, exterior, ascensor y balcón.",199000,3,1,76,2618,FLAT,SECOND_HAND,Barcelona,Trinitat Nova,https://www.habitaclia.com/comprar-piso-todo_reformado_exterior_ascensor_y_balcon_trinitat_nova-barcelona-i13370000000131.htm?pag=16&hab=1&ban=1&f=&geo=p&from=list&lo=55,"TODO REFORMADO, exterior, ascensor y balcón.  •	Habitación Doble con salida a balcón. •	Habitación Matrimonio. •	Hab...",2023-06-18
id2257004300766,Piso  Carrer del rector triadó. Piso de obra nueva planta baja con terraza,450000,2,2,96,4688,FLAT,SECOND_HAND,Barcelona,Hostafrancs,https://www.habitaclia.com/comprar-piso-de_obra_nueva_planta_baja_con_terraza_hostafrancs-barcelona-i2257004300766.htm?pag=16&hab=1&ban=1&f=&geo=p&from=list&lo=55,PROMOCIÓN DE OBRA NUEVA  Edificio de obra nueva con 6 viviendas exclusivas y zona comunitaria con piscina y jardín. ...,2023-06-18
id10024004257215,"Piso  en  Fabra i puig (rbla), 61. Pis en venda a la rambla de fabra i puig",283000,3,2,72,3931,FLAT,SECOND_HAND,Barcelona,Sant Andreu de Palomar,https://www.habitaclia.com/comprar-piso-pis_en_venda_a_la_rambla_de_fabra_i_puig_fabra_i_puig_rbla_61_sant_andreu_de_palomar-barcelona-i10024004257215.htm?pag=16&hab=1&ban=1&f=&geo=p&from=list&lo=55,"Pis de 72m2, totalment per reformar.  Tot exterior, amb molta llum i sol,amb  vistes al Club Natació Sant Andreu   M...",2023-06-18
id38188000001265,Piso  Vallès i ribot. Totalmente exterior,255000,2,1,65,3923,FLAT,SECOND_HAND,Barcelona,La Sagrera,https://www.habitaclia.com/comprar-piso-totalmente_exterior_la_sagrera-barcelona-i38188000001265.htm?pag=16&hab=1&ban=1&f=&geo=p&from=list&lo=55,"Vallès i Ribot - Plaça de l'Assemblea de Catalunya  Piso de 65m² en la Sagrera.  Totalmente exterior, con luz natura...",2023-06-18
id11568004272464,"Piso  Sant crispi. Piso con solarium de 24m2 y vistas tibidabo,  en la teixonera -",315000,2,2,86,3663,FLAT,SECOND_HAND,Barcelona,La Teixonera,https://www.habitaclia.com/comprar-piso-con_solarium_de_24m2_y_vistas_tibidabo_en_la_teixonera_la_teixonera-barcelona-i11568004272464.htm?pag=16&hab=1&ban=1&f=&geo=p&from=list&lo=55,Se ofrece el piso de 86 m2 ( 62 m2 del piso + 24 m2 del solárium con vistas a las montañas y al Tibidabo) y con balcón d...,2023-06-18
id2579003790346,Piso  Londres. Piso con 3 habitaciones con ascensor y calefacción,499000,3,2,126,3960,FLAT,SECOND_HAND,Barcelona,La Nova Esquerra de l´Eixample,https://www.habitaclia.com/comprar-piso-con_3_habitaciones_con_ascensor_y_calefaccion_la_nova_esquerra_de_l_eixample-barcelona-i2579003790346.htm?pag=16&hab=1&ban=1&f=&geo=p&from=list&lo=55,"IMPECABLE PISO EN LA ESQUERRA DEL EIXAMPLE,  A pocos minutos andando de la Plaza Francesc Macià y de la Avenida Josep...",2023-06-18
id3900004300826,Piso  en  Barri de les Corts. Piso muy bien situado junto a l'illa diagonal,475000,3,2,80,5938,FLAT,SECOND_HAND,Barcelona,Barri de les Corts,https://www.habitaclia.com/comprar-piso-muy_bien_situado_junto_a_l_illa_diagonal_barri_de_les_corts-barcelona-i3900004300826.htm?pag=17&hab=1&ban=1&f=&geo=p&from=list&lo=55,"Superficie: 80 m² aprox. Distribución:  Recibidor, salón comedor, cocina, 3 habitaciones, 2 baños, zona de aguas. 1 pla...",2023-06-18
id9433003077824,Piso  en  Sant Gervasi - Galvany. Piso alto y luminoso en venta junto a plaza molina.,560000,3,2,102,5490,FLAT,SECOND_HAND,Barcelona,Sant Gervasi,https://www.habitaclia.com/comprar-piso-alto_y_luminoso_en_venta_junto_a_plaza_molina_sant_gervasi_galvany-barcelona-i9433003077824.htm?pag=17&hab=1&ban=1&f=&geo=p&from=list&lo=55,"Os presentamos este piso ubicado en un edificio emblemático y con un premio FAD de diseño, en la Vía Augusta. El piso m...",2023-06-18
id19063000001663,Piso  Valldaura. Piso en venta en horta-guinardó,356000,4,2,305,1167,FLAT,SECOND_HAND,Barcelona,Horta,https://www.habitaclia.com/comprar-piso-en_venta_en_horta_guinardo_horta-barcelona-i19063000001663.htm?pag=17&hab=1&ban=1&f=&geo=p&from=list&lo=55,PROPIEDAD ÚNICA EN HORTA  COMPUESTA DE  VIVIENDA MÁS LOCAL EN UN ENTORNO PRIVILEGIADO Y JUNTO AL METRO (Passeig Valldaur...,2023-06-18
id45956000000010,Piso  Carrer de girona. Piso en venta en calle de girona,520000,3,2,81,6420,FLAT,SECOND_HAND,Barcelona,Dreta de l´Eixample,https://www.habitaclia.com/comprar-piso-en_venta_en_calle_de_girona_dreta_de_l_eixample-barcelona-i45956000000010.htm?pag=17&hab=1&ban=1&f=&geo=p&from=list&lo=55,"Homes by Gestilar presenta este espectacular inmueble exterior en REFORMA en el centro de Barcelona, con 81 m2 de superf...",2023-06-18
id3318004268363,Piso  en  Sant Martí de Provençals. Piso con 3 habitaciones con ascensor,235000,3,1,77,3052,FLAT,SECOND_HAND,Barcelona,Sant Martí de Provençals,https://www.habitaclia.com/comprar-piso-con_3_habitaciones_con_ascensor_sant_marti_de_provencals-barcelona-i3318004268363.htm?pag=17&hab=1&ban=1&f=&geo=p&from=list&lo=55,La Casa Agency vende:  Vivienda para entrar a vivir en la zona de Sant Martí de Provençals consta de 68mtrs útiles dis...,2023-06-18
id13895004371148,"Piso  Carrer dels ferrocarrils catalans. Piso con 4 habitaciones con ascensor, calefacción y aire acondic",290000,4,2,81,3580,FLAT,SECOND_HAND,Barcelona,La Marina del Port,https://www.habitaclia.com/comprar-piso-con_4_habitaciones_con_ascensor_calefaccion_y_aire_acondic_la_marina_del_port-barcelona-i13895004371148.htm?pag=17&hab=1&ban=1&f=&geo=p&from=list&lo=55,"Vivienda ubicada en calle tranquila y residencial, en el barrio de Can Sabatè.  6ª planta real en finca del año 1987 q...",2023-06-18
id36271004459843,Piso  Carrer villarroel. Obra nueva,505000,3,2,76,6645,FLAT,SECOND_HAND,Barcelona,L´Antiga Esquerra de l´Eixample,https://www.habitaclia.com/comprar-piso-obra_nueva_l_antiga_esquerra_de_l_eixample-barcelona-i36271004459843.htm?pag=17&hab=1&ban=1&f=&geo=p&from=list&lo=55,"En la Antiga Esquerra de l’Eixample, frente al Hospital Clínic de Barcelona, se sitúa este edificio. La finca se ha reha...",2023-06-18
id38188000001286,Piso  Premià. Reformado en sants,195000,1,1,47,4149,FLAT,SECOND_HAND,Barcelona,Sants,https://www.habitaclia.com/comprar-piso-reformado_en_sants_sants-barcelona-i38188000001286.htm?pag=17&hab=1&ban=1&f=&geo=p&from=list&lo=55,"Piso reformado de 47m² en Sants.  Totalmente exterior, con luz natural en todas las estancias.  Consta de amplia zon...",2023-06-18
id38188000001252,Piso  Nàpols. Nuevo a estrenar | finca regia | oportunidad,470000,3,2,85,5529,FLAT,SECOND_HAND,Barcelona,Dreta de l´Eixample,https://www.habitaclia.com/comprar-piso-nuevo_a_estrenar_finca_regia_oportunidad_dreta_de_l_eixample-barcelona-i38188000001252.htm?pag=17&hab=1&ban=1&f=&geo=p&from=list&lo=55,Nàpols - Rosselló - Provença  Piso nuevo a estrenar de 85m² en la Dreta de l'Eixample.  En la quinta planta exterior...,2023-06-18
id15172002944421,Piso  De la font del coll. Piso en venta en el coll,360000,3,2,95,3789,FLAT,SECOND_HAND,Barcelona,El Coll,https://www.habitaclia.com/comprar-piso-en_venta_en_el_coll_el_coll-barcelona-i15172002944421.htm?pag=17&hab=1&ban=1&f=&geo=p&from=list&lo=55,"Si quieres vivir en la ciudad con todas las comodidades a tu alcance y sentir que no estás en ella, no lo dudes, este es...",2023-06-18
id9354004269957,"Casa adosada  en  Tres Torres. Casa adosada con 4 habitaciones con parking, calefacción y aire",1695000,4,5,390,4346,SINGLE_FAMILY_SEMI_DETACHED,SECOND_HAND,Barcelona,Tres Torres,https://www.habitaclia.com/comprar-casa_adosada-con_4_habitaciones_con_parking_calefaccion_y_aire_tres_torres-barcelona-i9354004269957.htm?pag=17&hab=1&ban=1&f=&geo=p&from=list&lo=55,"Casa en venta en Sarriá, Barcelona. Situada en el exclusivo barrio de Sarriá encontramos esta casa de 390m2 aproximadame...",2023-06-18
id15471000037735,"Piso  en  L´Antiga Esquerra de l´Eixample. Piso con 2 habitaciones con ascensor, calefacción y aire acondic",389000,2,1,50,7780,FLAT,SECOND_HAND,Barcelona,L´Antiga Esquerra de l´Eixample,https://www.habitaclia.com/comprar-piso-con_2_habitaciones_con_ascensor_calefaccion_y_aire_acondic_l_antiga_esquerra_de_l_eixample-barcelona-i15471000037735.htm?pag=17&hab=1&ban=1&f=&geo=p&from=list&lo=55,Ha encontrado el ático de sus sueños!  Sergi Bargalló y su equipo de IAD le presentan este soleado ático con terraza y...,2023-06-18
id10051004447526,Piso  Carrer muntaner. Obra nueva,870000,3,2,133,6541,FLAT,SECOND_HAND,Barcelona,Sant Gervasi,https://www.habitaclia.com/comprar-piso-obra_nueva_sant_gervasi_bonanova-barcelona-i10051004447526.htm?pag=17&hab=1&ban=1&f=&geo=p&from=list&lo=55,"En la rehabilitación se ha conseguido un amplio espacio que engloba la entrada, la cocina y un luminoso salón-comedor qu...",2023-06-18
id11568004272410,"Piso  Numancia. Obra nueva, con terraza y piscina",540000,2,1,75,7200,FLAT,SECOND_HAND,Barcelona,Barri de les Corts,https://www.habitaclia.com/comprar-piso-obra_nueva_con_terraza_y_piscina_barri_de_les_corts-barcelona-i11568004272410.htm?pag=17&hab=1&ban=1&f=&geo=p&from=list&lo=55,"Vivienda alta y luminosa de obra nueva con terraza y piscina comunitaria. Destaca por su distribución moderna, funcional...",2023-06-18
id2257004300852,Piso  Carrer de trafalgar. Magnífico piso alto con vistas de toda barcelona,1100000,3,2,195,5641,FLAT,SECOND_HAND,Barcelona,Dreta de l´Eixample,https://www.habitaclia.com/comprar-piso-magnifico_alto_con_vistas_de_toda_dreta_de_l_eixample-barcelona-i2257004300852.htm?pag=17&hab=1&ban=1&f=&geo=p&from=list&lo=55,Magnífico piso alto con vistas de toda Barcelona  Este gran apartamento reformado a estrenar se encuentra en el primer...,2023-06-18
id2257004300854,Piso  Carrer de balmes. Gran piso alto y luminoso con soleada terraza en sant gervasi,1250000,5,3,262,4771,FLAT,SECOND_HAND,Barcelona,Sant Gervasi,https://www.habitaclia.com/comprar-piso-gran_alto_y_luminoso_con_soleada_terraza_en_sant_gervasi_sant_gervasi_bonanova-barcelona-i2257004300854.htm?pag=18&hab=1&ban=1&f=&geo=p&from=list&lo=55,Gran piso alto y luminoso con soleada terraza en Sant Gervasi  Elegante vivienda localizada en una tranquila zona resi...,2023-06-18
id46038000000069,Piso  Carrer de sant jordi. Piso en el mercado de sants,327000,3,1,78,4192,FLAT,SECOND_HAND,Barcelona,Sants,https://www.habitaclia.com/comprar-piso-en_el_mercado_de_sants_sants-barcelona-i46038000000069.htm?pag=18&hab=1&ban=1&f=&geo=p&from=list&lo=55,"piso frente el mercado de sants, consta de tres habitaciones, dos individuales y una doble, un baño, cocina, salón, come...",2023-06-18
id12826004094624,Piso  Provença. Piso con 3 habitaciones con calefacción y aire acondicionado,565000,3,3,113,5000,FLAT,SECOND_HAND,Barcelona,L´Antiga Esquerra de l´Eixample,https://www.habitaclia.com/comprar-piso-con_3_habitaciones_con_calefaccion_y_aire_acondicionado_l_antiga_esquerra_de_l_eixample-barcelona-i12826004094624.htm?pag=18&hab=1&ban=1&f=&geo=p&from=list&lo=55,"A ESTRENAR. Piso de 100m² recién reformado en venta ubicado en la Eixample Izquierda, en el corazón de Barcelona.  Muy...",2023-06-18
id1097002352689,Casa adosada  Carrer de sant narcís. Casa adosada con 4 habitaciones con calefacción y aire acondicio,550000,4,3,145,3793,SINGLE_FAMILY_SEMI_DETACHED,SECOND_HAND,Barcelona,Sant Andreu de Palomar,https://www.habitaclia.com/comprar-casa_adosada-con_4_habitaciones_con_calefaccion_y_aire_acondicio_sant_andreu_de_palomar-barcelona-i1097002352689.htm?pag=18&hab=1&ban=1&f=&geo=p&from=list&lo=55,"Fabulosa casa adosada en el corazón de Sant Andreu, en calle semipeatonal. El inmueble consta de 145 m2 construidos y se...",2023-06-18
id39433004332747,Casa  en  Torre Baró. Casa con vistas a la montaña totalmente exterior,289000,3,1,300,963,HOUSE,SECOND_HAND,Barcelona,Torre Baró,https://www.habitaclia.com/comprar-casa-con_vistas_a_la_montana_totalmente_exterior_torre_baro-barcelona-i39433004332747.htm?pag=18&hab=1&ban=1&f=&geo=p&from=list&lo=55,Tecnocasa Desarrollo Carrer Mina de la Ciutat S. L tiene el placer de presentarles este inmueble el cual tenemos en cart...,2023-06-18
